en,fr,it,de,es,ko,kana
"It eats dreams and releases mist. The mist is pink when it’s eating a good dream, and black when it’s eating a nightmare.","It eats dreams and releases mist. The mist is pink when it’s eating a good dream, and black when it’s eating a nightmare.","It eats dreams and releases mist. The mist is pink when it’s eating a good dream, and black when it’s eating a nightmare.","It eats dreams and releases mist. The mist is pink when it’s eating a good dream, and black when it’s eating a nightmare.","It eats dreams and releases mist. The mist is pink when it’s eating a good dream, and black when it’s eating a nightmare.","It eats dreams and releases mist. The mist is pink when it’s eating a good dream, and black when it’s eating a nightmare.","It eats dreams and releases mist. The mist is pink when it’s eating a good dream, and black when it’s eating a nightmare."
"It drowses and dreams all the time. It’s best to leave it be if it’s just woken up, as it’s a terrible grump when freshly roused from sleep.","It drowses and dreams all the time. It’s best to leave it be if it’s just woken up, as it’s a terrible grump when freshly roused from sleep.","It drowses and dreams all the time. It’s best to leave it be if it’s just woken up, as it’s a terrible grump when freshly roused from sleep.","It drowses and dreams all the time. It’s best to leave it be if it’s just woken up, as it’s a terrible grump when freshly roused from sleep.","It drowses and dreams all the time. It’s best to leave it be if it’s just woken up, as it’s a terrible grump when freshly roused from sleep.","It drowses and dreams all the time. It’s best to leave it be if it’s just woken up, as it’s a terrible grump when freshly roused from sleep.","It drowses and dreams all the time. It’s best to leave it be if it’s just woken up, as it’s a terrible grump when freshly roused from sleep."
"It’s forgetful and not very bright, but many Trainers love it anyway for its friendliness and sincerity.","It’s forgetful and not very bright, but many Trainers love it anyway for its friendliness and sincerity.","It’s forgetful and not very bright, but many Trainers love it anyway for its friendliness and sincerity.","It’s forgetful and not very bright, but many Trainers love it anyway for its friendliness and sincerity.","It’s forgetful and not very bright, but many Trainers love it anyway for its friendliness and sincerity.","It’s forgetful and not very bright, but many Trainers love it anyway for its friendliness and sincerity.","It’s forgetful and not very bright, but many Trainers love it anyway for its friendliness and sincerity."
These bright Pokémon have acute memories. Apparently delivery workers often choose them as their partners.,These bright Pokémon have acute memories. Apparently delivery workers often choose them as their partners.,These bright Pokémon have acute memories. Apparently delivery workers often choose them as their partners.,These bright Pokémon have acute memories. Apparently delivery workers often choose them as their partners.,These bright Pokémon have acute memories. Apparently delivery workers often choose them as their partners.,These bright Pokémon have acute memories. Apparently delivery workers often choose them as their partners.,These bright Pokémon have acute memories. Apparently delivery workers often choose them as their partners.
!!!Placeholder!!!,!!!Placeholder!!!,!!!Placeholder!!!,!!!Placeholder!!!,!!!Placeholder!!!,!!!Placeholder!!!,!!!Placeholder!!!
!!!Placeholder!!!,!!!Placeholder!!!,!!!Placeholder!!!,!!!Placeholder!!!,!!!Placeholder!!!,!!!Placeholder!!!,!!!Placeholder!!!
!!!Placeholder!!!,!!!Placeholder!!!,!!!Placeholder!!!,!!!Placeholder!!!,!!!Placeholder!!!,!!!Placeholder!!!,!!!Placeholder!!!
"The hexagonal hole is its ear. Deep in that ear is an energy core, so if you stick your hand in there, Roggenrola will be very angry!","The hexagonal hole is its ear. Deep in that ear is an energy core, so if you stick your hand in there, Roggenrola will be very angry!","The hexagonal hole is its ear. Deep in that ear is an energy core, so if you stick your hand in there, Roggenrola will be very angry!","The hexagonal hole is its ear. Deep in that ear is an energy core, so if you stick your hand in there, Roggenrola will be very angry!","The hexagonal hole is its ear. Deep in that ear is an energy core, so if you stick your hand in there, Roggenrola will be very angry!","The hexagonal hole is its ear. Deep in that ear is an energy core, so if you stick your hand in there, Roggenrola will be very angry!","The hexagonal hole is its ear. Deep in that ear is an energy core, so if you stick your hand in there, Roggenrola will be very angry!"
The energy overflowing from its body has turned into orange crystals that are hard enough to smash diamonds.,The energy overflowing from its body has turned into orange crystals that are hard enough to smash diamonds.,The energy overflowing from its body has turned into orange crystals that are hard enough to smash diamonds.,The energy overflowing from its body has turned into orange crystals that are hard enough to smash diamonds.,The energy overflowing from its body has turned into orange crystals that are hard enough to smash diamonds.,The energy overflowing from its body has turned into orange crystals that are hard enough to smash diamonds.,The energy overflowing from its body has turned into orange crystals that are hard enough to smash diamonds.
"When it fires off energy with all its might, the power creates countless fissures on its body.","When it fires off energy with all its might, the power creates countless fissures on its body.","When it fires off energy with all its might, the power creates countless fissures on its body.","When it fires off energy with all its might, the power creates countless fissures on its body.","When it fires off energy with all its might, the power creates countless fissures on its body.","When it fires off energy with all its might, the power creates countless fissures on its body.","When it fires off energy with all its might, the power creates countless fissures on its body."
"It emits ultrasonic waves as it flutters about, searching for its prey—bug Pokémon.","It emits ultrasonic waves as it flutters about, searching for its prey—bug Pokémon.","It emits ultrasonic waves as it flutters about, searching for its prey—bug Pokémon.","It emits ultrasonic waves as it flutters about, searching for its prey—bug Pokémon.","It emits ultrasonic waves as it flutters about, searching for its prey—bug Pokémon.","It emits ultrasonic waves as it flutters about, searching for its prey—bug Pokémon.","It emits ultrasonic waves as it flutters about, searching for its prey—bug Pokémon."
The auspicious shape of this Pokémon’s nose apparently led some regions to consider Swoobat a symbol of good luck.,The auspicious shape of this Pokémon’s nose apparently led some regions to consider Swoobat a symbol of good luck.,The auspicious shape of this Pokémon’s nose apparently led some regions to consider Swoobat a symbol of good luck.,The auspicious shape of this Pokémon’s nose apparently led some regions to consider Swoobat a symbol of good luck.,The auspicious shape of this Pokémon’s nose apparently led some regions to consider Swoobat a symbol of good luck.,The auspicious shape of this Pokémon’s nose apparently led some regions to consider Swoobat a symbol of good luck.,The auspicious shape of this Pokémon’s nose apparently led some regions to consider Swoobat a symbol of good luck.
"It’s a digger, using its claws to burrow through the ground. It causes damage to vegetable crops, so many farmers have little love for it.","It’s a digger, using its claws to burrow through the ground. It causes damage to vegetable crops, so many farmers have little love for it.","It’s a digger, using its claws to burrow through the ground. It causes damage to vegetable crops, so many farmers have little love for it.","It’s a digger, using its claws to burrow through the ground. It causes damage to vegetable crops, so many farmers have little love for it.","It’s a digger, using its claws to burrow through the ground. It causes damage to vegetable crops, so many farmers have little love for it.","It’s a digger, using its claws to burrow through the ground. It causes damage to vegetable crops, so many farmers have little love for it.","It’s a digger, using its claws to burrow through the ground. It causes damage to vegetable crops, so many farmers have little love for it."
"Known as the Drill King, this Pokémon can tunnel through the terrain at speeds of over 90 mph.","Known as the Drill King, this Pokémon can tunnel through the terrain at speeds of over 90 mph.","Known as the Drill King, this Pokémon can tunnel through the terrain at speeds of over 90 mph.","Known as the Drill King, this Pokémon can tunnel through the terrain at speeds of over 90 mph.","Known as the Drill King, this Pokémon can tunnel through the terrain at speeds of over 90 mph.","Known as the Drill King, this Pokémon can tunnel through the terrain at speeds of over 90 mph.","Known as the Drill King, this Pokémon can tunnel through the terrain at speeds of over 90 mph."
"This Pokémon has a kind heart. By touching with its feelers, Audino can gauge other creatures’ feelings and physical conditions.","This Pokémon has a kind heart. By touching with its feelers, Audino can gauge other creatures’ feelings and physical conditions.","This Pokémon has a kind heart. By touching with its feelers, Audino can gauge other creatures’ feelings and physical conditions.","This Pokémon has a kind heart. By touching with its feelers, Audino can gauge other creatures’ feelings and physical conditions.","This Pokémon has a kind heart. By touching with its feelers, Audino can gauge other creatures’ feelings and physical conditions.","This Pokémon has a kind heart. By touching with its feelers, Audino can gauge other creatures’ feelings and physical conditions.","This Pokémon has a kind heart. By touching with its feelers, Audino can gauge other creatures’ feelings and physical conditions."
Timburr that have started carrying logs that are about three times their size are nearly ready to evolve.,Timburr that have started carrying logs that are about three times their size are nearly ready to evolve.,Timburr that have started carrying logs that are about three times their size are nearly ready to evolve.,Timburr that have started carrying logs that are about three times their size are nearly ready to evolve.,Timburr that have started carrying logs that are about three times their size are nearly ready to evolve.,Timburr that have started carrying logs that are about three times their size are nearly ready to evolve.,Timburr that have started carrying logs that are about three times their size are nearly ready to evolve.
"Gurdurr excels at demolition—construction is not its forte. In any case, there’s skill in the way this Pokémon wields its metal beam.","Gurdurr excels at demolition—construction is not its forte. In any case, there’s skill in the way this Pokémon wields its metal beam.","Gurdurr excels at demolition—construction is not its forte. In any case, there’s skill in the way this Pokémon wields its metal beam.","Gurdurr excels at demolition—construction is not its forte. In any case, there’s skill in the way this Pokémon wields its metal beam.","Gurdurr excels at demolition—construction is not its forte. In any case, there’s skill in the way this Pokémon wields its metal beam.","Gurdurr excels at demolition—construction is not its forte. In any case, there’s skill in the way this Pokémon wields its metal beam.","Gurdurr excels at demolition—construction is not its forte. In any case, there’s skill in the way this Pokémon wields its metal beam."
"When going all out, this Pokémon throws aside its concrete pillars and leaps at opponents to pummel them with its fists.","When going all out, this Pokémon throws aside its concrete pillars and leaps at opponents to pummel them with its fists.","When going all out, this Pokémon throws aside its concrete pillars and leaps at opponents to pummel them with its fists.","When going all out, this Pokémon throws aside its concrete pillars and leaps at opponents to pummel them with its fists.","When going all out, this Pokémon throws aside its concrete pillars and leaps at opponents to pummel them with its fists.","When going all out, this Pokémon throws aside its concrete pillars and leaps at opponents to pummel them with its fists.","When going all out, this Pokémon throws aside its concrete pillars and leaps at opponents to pummel them with its fists."
It uses sound waves to communicate with others of its kind. People and other Pokémon species can’t hear its cries of warning.,It uses sound waves to communicate with others of its kind. People and other Pokémon species can’t hear its cries of warning.,It uses sound waves to communicate with others of its kind. People and other Pokémon species can’t hear its cries of warning.,It uses sound waves to communicate with others of its kind. People and other Pokémon species can’t hear its cries of warning.,It uses sound waves to communicate with others of its kind. People and other Pokémon species can’t hear its cries of warning.,It uses sound waves to communicate with others of its kind. People and other Pokémon species can’t hear its cries of warning.,It uses sound waves to communicate with others of its kind. People and other Pokémon species can’t hear its cries of warning.
"On occasion, their cries are sublimely pleasing to the ear. Palpitoad with larger lumps on their bodies can sing with a wider range of sounds.","On occasion, their cries are sublimely pleasing to the ear. Palpitoad with larger lumps on their bodies can sing with a wider range of sounds.","On occasion, their cries are sublimely pleasing to the ear. Palpitoad with larger lumps on their bodies can sing with a wider range of sounds.","On occasion, their cries are sublimely pleasing to the ear. Palpitoad with larger lumps on their bodies can sing with a wider range of sounds.","On occasion, their cries are sublimely pleasing to the ear. Palpitoad with larger lumps on their bodies can sing with a wider range of sounds.","On occasion, their cries are sublimely pleasing to the ear. Palpitoad with larger lumps on their bodies can sing with a wider range of sounds.","On occasion, their cries are sublimely pleasing to the ear. Palpitoad with larger lumps on their bodies can sing with a wider range of sounds."
"This Pokémon is popular among the elderly, who say the vibrations of its lumps are great for massages.","This Pokémon is popular among the elderly, who say the vibrations of its lumps are great for massages.","This Pokémon is popular among the elderly, who say the vibrations of its lumps are great for massages.","This Pokémon is popular among the elderly, who say the vibrations of its lumps are great for massages.","This Pokémon is popular among the elderly, who say the vibrations of its lumps are great for massages.","This Pokémon is popular among the elderly, who say the vibrations of its lumps are great for massages.","This Pokémon is popular among the elderly, who say the vibrations of its lumps are great for massages."
They train in groups of five. Any member that can’t keep up will discard its belt and leave the group.,They train in groups of five. Any member that can’t keep up will discard its belt and leave the group.,They train in groups of five. Any member that can’t keep up will discard its belt and leave the group.,They train in groups of five. Any member that can’t keep up will discard its belt and leave the group.,They train in groups of five. Any member that can’t keep up will discard its belt and leave the group.,They train in groups of five. Any member that can’t keep up will discard its belt and leave the group.,They train in groups of five. Any member that can’t keep up will discard its belt and leave the group.
The karate chops of a Sawk that’s trained itself to the limit can cleave the ocean itself.,The karate chops of a Sawk that’s trained itself to the limit can cleave the ocean itself.,The karate chops of a Sawk that’s trained itself to the limit can cleave the ocean itself.,The karate chops of a Sawk that’s trained itself to the limit can cleave the ocean itself.,The karate chops of a Sawk that’s trained itself to the limit can cleave the ocean itself.,The karate chops of a Sawk that’s trained itself to the limit can cleave the ocean itself.,The karate chops of a Sawk that’s trained itself to the limit can cleave the ocean itself.
!!!Placeholder!!!,!!!Placeholder!!!,!!!Placeholder!!!,!!!Placeholder!!!,!!!Placeholder!!!,!!!Placeholder!!!,!!!Placeholder!!!
!!!Placeholder!!!,!!!Placeholder!!!,!!!Placeholder!!!,!!!Placeholder!!!,!!!Placeholder!!!,!!!Placeholder!!!,!!!Placeholder!!!
!!!Placeholder!!!,!!!Placeholder!!!,!!!Placeholder!!!,!!!Placeholder!!!,!!!Placeholder!!!,!!!Placeholder!!!,!!!Placeholder!!!
"Its fangs are highly venomous. If this Pokémon finds prey it thinks it can eat, it leaps for them without any thought of how things might turn out.","Its fangs are highly venomous. If this Pokémon finds prey it thinks it can eat, it leaps for them without any thought of how things might turn out.","Its fangs are highly venomous. If this Pokémon finds prey it thinks it can eat, it leaps for them without any thought of how things might turn out.","Its fangs are highly venomous. If this Pokémon finds prey it thinks it can eat, it leaps for them without any thought of how things might turn out.","Its fangs are highly venomous. If this Pokémon finds prey it thinks it can eat, it leaps for them without any thought of how things might turn out.","Its fangs are highly venomous. If this Pokémon finds prey it thinks it can eat, it leaps for them without any thought of how things might turn out.","Its fangs are highly venomous. If this Pokémon finds prey it thinks it can eat, it leaps for them without any thought of how things might turn out."
Whirlipede protects itself with a sturdy shell and poisonous spikes while it stores up the energy it’ll need for evolution.,Whirlipede protects itself with a sturdy shell and poisonous spikes while it stores up the energy it’ll need for evolution.,Whirlipede protects itself with a sturdy shell and poisonous spikes while it stores up the energy it’ll need for evolution.,Whirlipede protects itself with a sturdy shell and poisonous spikes while it stores up the energy it’ll need for evolution.,Whirlipede protects itself with a sturdy shell and poisonous spikes while it stores up the energy it’ll need for evolution.,Whirlipede protects itself with a sturdy shell and poisonous spikes while it stores up the energy it’ll need for evolution.,Whirlipede protects itself with a sturdy shell and poisonous spikes while it stores up the energy it’ll need for evolution.
"Scolipede engage in fierce territorial battles with Centiskorch. At the end of one of these battles, the victor makes a meal of the loser.","Scolipede engage in fierce territorial battles with Centiskorch. At the end of one of these battles, the victor makes a meal of the loser.","Scolipede engage in fierce territorial battles with Centiskorch. At the end of one of these battles, the victor makes a meal of the loser.","Scolipede engage in fierce territorial battles with Centiskorch. At the end of one of these battles, the victor makes a meal of the loser.","Scolipede engage in fierce territorial battles with Centiskorch. At the end of one of these battles, the victor makes a meal of the loser.","Scolipede engage in fierce territorial battles with Centiskorch. At the end of one of these battles, the victor makes a meal of the loser.","Scolipede engage in fierce territorial battles with Centiskorch. At the end of one of these battles, the victor makes a meal of the loser."
"To protect itself, it shoots cotton from its body. When it gets wet in the rain, its cotton grows moist and heavy, and it can’t move as well.","To protect itself, it shoots cotton from its body. When it gets wet in the rain, its cotton grows moist and heavy, and it can’t move as well.","To protect itself, it shoots cotton from its body. When it gets wet in the rain, its cotton grows moist and heavy, and it can’t move as well.","To protect itself, it shoots cotton from its body. When it gets wet in the rain, its cotton grows moist and heavy, and it can’t move as well.","To protect itself, it shoots cotton from its body. When it gets wet in the rain, its cotton grows moist and heavy, and it can’t move as well.","To protect itself, it shoots cotton from its body. When it gets wet in the rain, its cotton grows moist and heavy, and it can’t move as well.","To protect itself, it shoots cotton from its body. When it gets wet in the rain, its cotton grows moist and heavy, and it can’t move as well."
"This nuisance sneaks into people’s homes, where it hides important things and scatters cotton all over the place.","This nuisance sneaks into people’s homes, where it hides important things and scatters cotton all over the place.","This nuisance sneaks into people’s homes, where it hides important things and scatters cotton all over the place.","This nuisance sneaks into people’s homes, where it hides important things and scatters cotton all over the place.","This nuisance sneaks into people’s homes, where it hides important things and scatters cotton all over the place.","This nuisance sneaks into people’s homes, where it hides important things and scatters cotton all over the place.","This nuisance sneaks into people’s homes, where it hides important things and scatters cotton all over the place."
"Some say if you dry the leaves on its head, boil them down, and drink the infusion, your vigor will return, so Petilil is popular with the elderly.","Some say if you dry the leaves on its head, boil them down, and drink the infusion, your vigor will return, so Petilil is popular with the elderly.","Some say if you dry the leaves on its head, boil them down, and drink the infusion, your vigor will return, so Petilil is popular with the elderly.","Some say if you dry the leaves on its head, boil them down, and drink the infusion, your vigor will return, so Petilil is popular with the elderly.","Some say if you dry the leaves on its head, boil them down, and drink the infusion, your vigor will return, so Petilil is popular with the elderly.","Some say if you dry the leaves on its head, boil them down, and drink the infusion, your vigor will return, so Petilil is popular with the elderly.","Some say if you dry the leaves on its head, boil them down, and drink the infusion, your vigor will return, so Petilil is popular with the elderly."
The fragrance of its flower differs slightly depending on the soil where it grew up. Sniffing the aroma calms your heart and mind.,The fragrance of its flower differs slightly depending on the soil where it grew up. Sniffing the aroma calms your heart and mind.,The fragrance of its flower differs slightly depending on the soil where it grew up. Sniffing the aroma calms your heart and mind.,The fragrance of its flower differs slightly depending on the soil where it grew up. Sniffing the aroma calms your heart and mind.,The fragrance of its flower differs slightly depending on the soil where it grew up. Sniffing the aroma calms your heart and mind.,The fragrance of its flower differs slightly depending on the soil where it grew up. Sniffing the aroma calms your heart and mind.,The fragrance of its flower differs slightly depending on the soil where it grew up. Sniffing the aroma calms your heart and mind.
!!!Placeholder!!!,!!!Placeholder!!!,!!!Placeholder!!!,!!!Placeholder!!!,!!!Placeholder!!!,!!!Placeholder!!!,!!!Placeholder!!!
"Alola, where it’s warm all year round, is a comfortable environment for this Pokémon. Sometimes you’ll even see it outside of deserts.","Alola, where it’s warm all year round, is a comfortable environment for this Pokémon. Sometimes you’ll even see it outside of deserts.","Alola, where it’s warm all year round, is a comfortable environment for this Pokémon. Sometimes you’ll even see it outside of deserts.","Alola, where it’s warm all year round, is a comfortable environment for this Pokémon. Sometimes you’ll even see it outside of deserts.","Alola, where it’s warm all year round, is a comfortable environment for this Pokémon. Sometimes you’ll even see it outside of deserts.","Alola, where it’s warm all year round, is a comfortable environment for this Pokémon. Sometimes you’ll even see it outside of deserts.","Alola, where it’s warm all year round, is a comfortable environment for this Pokémon. Sometimes you’ll even see it outside of deserts."
