en,fr,it,de,es,ko,kana
"It stands in front of a mirror, trying to fix its broken neck as if its life depended on it. It has a hard time getting it right, so it’s crying inside.","It stands in front of a mirror, trying to fix its broken neck as if its life depended on it. It has a hard time getting it right, so it’s crying inside.","It stands in front of a mirror, trying to fix its broken neck as if its life depended on it. It has a hard time getting it right, so it’s crying inside.","It stands in front of a mirror, trying to fix its broken neck as if its life depended on it. It has a hard time getting it right, so it’s crying inside.","It stands in front of a mirror, trying to fix its broken neck as if its life depended on it. It has a hard time getting it right, so it’s crying inside.","It stands in front of a mirror, trying to fix its broken neck as if its life depended on it. It has a hard time getting it right, so it’s crying inside.","It stands in front of a mirror, trying to fix its broken neck as if its life depended on it. It has a hard time getting it right, so it’s crying inside."
"It burrows beneath the sand, radiating psychic power from the protuberance on its head. It waits for prey as it surveys the area.","It burrows beneath the sand, radiating psychic power from the protuberance on its head. It waits for prey as it surveys the area.","It burrows beneath the sand, radiating psychic power from the protuberance on its head. It waits for prey as it surveys the area.","It burrows beneath the sand, radiating psychic power from the protuberance on its head. It waits for prey as it surveys the area.","It burrows beneath the sand, radiating psychic power from the protuberance on its head. It waits for prey as it surveys the area.","It burrows beneath the sand, radiating psychic power from the protuberance on its head. It waits for prey as it surveys the area.","It burrows beneath the sand, radiating psychic power from the protuberance on its head. It waits for prey as it surveys the area."
"If a child it has made friends with is bullied, Drampa will find the bully’s house and burn it to the ground.","If a child it has made friends with is bullied, Drampa will find the bully’s house and burn it to the ground.","If a child it has made friends with is bullied, Drampa will find the bully’s house and burn it to the ground.","If a child it has made friends with is bullied, Drampa will find the bully’s house and burn it to the ground.","If a child it has made friends with is bullied, Drampa will find the bully’s house and burn it to the ground.","If a child it has made friends with is bullied, Drampa will find the bully’s house and burn it to the ground.","If a child it has made friends with is bullied, Drampa will find the bully’s house and burn it to the ground."
It wraps its prey in green seaweed and sucks away their vitality. It only likes to go after big prey like Wailord.,It wraps its prey in green seaweed and sucks away their vitality. It only likes to go after big prey like Wailord.,It wraps its prey in green seaweed and sucks away their vitality. It only likes to go after big prey like Wailord.,It wraps its prey in green seaweed and sucks away their vitality. It only likes to go after big prey like Wailord.,It wraps its prey in green seaweed and sucks away their vitality. It only likes to go after big prey like Wailord.,It wraps its prey in green seaweed and sucks away their vitality. It only likes to go after big prey like Wailord.,It wraps its prey in green seaweed and sucks away their vitality. It only likes to go after big prey like Wailord.
It smacks the scales on its head against rocks or against the ground to frighten its opponents. It can also contact its friends with these noises.,It smacks the scales on its head against rocks or against the ground to frighten its opponents. It can also contact its friends with these noises.,It smacks the scales on its head against rocks or against the ground to frighten its opponents. It can also contact its friends with these noises.,It smacks the scales on its head against rocks or against the ground to frighten its opponents. It can also contact its friends with these noises.,It smacks the scales on its head against rocks or against the ground to frighten its opponents. It can also contact its friends with these noises.,It smacks the scales on its head against rocks or against the ground to frighten its opponents. It can also contact its friends with these noises.,It smacks the scales on its head against rocks or against the ground to frighten its opponents. It can also contact its friends with these noises.
"It makes noise by clanging its scales together. When the rhythm has reached its peak, Hakamo-o attacks.","It makes noise by clanging its scales together. When the rhythm has reached its peak, Hakamo-o attacks.","It makes noise by clanging its scales together. When the rhythm has reached its peak, Hakamo-o attacks.","It makes noise by clanging its scales together. When the rhythm has reached its peak, Hakamo-o attacks.","It makes noise by clanging its scales together. When the rhythm has reached its peak, Hakamo-o attacks.","It makes noise by clanging its scales together. When the rhythm has reached its peak, Hakamo-o attacks.","It makes noise by clanging its scales together. When the rhythm has reached its peak, Hakamo-o attacks."
"When it howls after finishing off its prey, the metallic sounds of its celebrating comrades can be heard from all around.","When it howls after finishing off its prey, the metallic sounds of its celebrating comrades can be heard from all around.","When it howls after finishing off its prey, the metallic sounds of its celebrating comrades can be heard from all around.","When it howls after finishing off its prey, the metallic sounds of its celebrating comrades can be heard from all around.","When it howls after finishing off its prey, the metallic sounds of its celebrating comrades can be heard from all around.","When it howls after finishing off its prey, the metallic sounds of its celebrating comrades can be heard from all around.","When it howls after finishing off its prey, the metallic sounds of its celebrating comrades can be heard from all around."
"Although it’s called a guardian deity, if a person or Pokémon puts it in a bad mood, it will become a malevolent deity and attack.","Although it’s called a guardian deity, if a person or Pokémon puts it in a bad mood, it will become a malevolent deity and attack.","Although it’s called a guardian deity, if a person or Pokémon puts it in a bad mood, it will become a malevolent deity and attack.","Although it’s called a guardian deity, if a person or Pokémon puts it in a bad mood, it will become a malevolent deity and attack.","Although it’s called a guardian deity, if a person or Pokémon puts it in a bad mood, it will become a malevolent deity and attack.","Although it’s called a guardian deity, if a person or Pokémon puts it in a bad mood, it will become a malevolent deity and attack.","Although it’s called a guardian deity, if a person or Pokémon puts it in a bad mood, it will become a malevolent deity and attack."
It heals the wounds of people and Pokémon by sprinkling them with its sparkling scales. This guardian deity is worshiped on Akala.,It heals the wounds of people and Pokémon by sprinkling them with its sparkling scales. This guardian deity is worshiped on Akala.,It heals the wounds of people and Pokémon by sprinkling them with its sparkling scales. This guardian deity is worshiped on Akala.,It heals the wounds of people and Pokémon by sprinkling them with its sparkling scales. This guardian deity is worshiped on Akala.,It heals the wounds of people and Pokémon by sprinkling them with its sparkling scales. This guardian deity is worshiped on Akala.,It heals the wounds of people and Pokémon by sprinkling them with its sparkling scales. This guardian deity is worshiped on Akala.,It heals the wounds of people and Pokémon by sprinkling them with its sparkling scales. This guardian deity is worshiped on Akala.
"Although it’s called a guardian deity, it’s violent enough to crush anyone it sees as an enemy.","Although it’s called a guardian deity, it’s violent enough to crush anyone it sees as an enemy.","Although it’s called a guardian deity, it’s violent enough to crush anyone it sees as an enemy.","Although it’s called a guardian deity, it’s violent enough to crush anyone it sees as an enemy.","Although it’s called a guardian deity, it’s violent enough to crush anyone it sees as an enemy.","Although it’s called a guardian deity, it’s violent enough to crush anyone it sees as an enemy.","Although it’s called a guardian deity, it’s violent enough to crush anyone it sees as an enemy."
"This guardian deity of Poni Island manipulates water. Because it lives deep within a thick fog, it came to be both feared and revered.","This guardian deity of Poni Island manipulates water. Because it lives deep within a thick fog, it came to be both feared and revered.","This guardian deity of Poni Island manipulates water. Because it lives deep within a thick fog, it came to be both feared and revered.","This guardian deity of Poni Island manipulates water. Because it lives deep within a thick fog, it came to be both feared and revered.","This guardian deity of Poni Island manipulates water. Because it lives deep within a thick fog, it came to be both feared and revered.","This guardian deity of Poni Island manipulates water. Because it lives deep within a thick fog, it came to be both feared and revered.","This guardian deity of Poni Island manipulates water. Because it lives deep within a thick fog, it came to be both feared and revered."
"Even though its helpless, gaseous body can be blown away by the slightest breeze, it doesn’t seem to care.","Even though its helpless, gaseous body can be blown away by the slightest breeze, it doesn’t seem to care.","Even though its helpless, gaseous body can be blown away by the slightest breeze, it doesn’t seem to care.","Even though its helpless, gaseous body can be blown away by the slightest breeze, it doesn’t seem to care.","Even though its helpless, gaseous body can be blown away by the slightest breeze, it doesn’t seem to care.","Even though its helpless, gaseous body can be blown away by the slightest breeze, it doesn’t seem to care.","Even though its helpless, gaseous body can be blown away by the slightest breeze, it doesn’t seem to care."
The king who ruled Alola in times of antiquity called it the “cocoon of the stars” and built an altar to worship it.,The king who ruled Alola in times of antiquity called it the “cocoon of the stars” and built an altar to worship it.,The king who ruled Alola in times of antiquity called it the “cocoon of the stars” and built an altar to worship it.,The king who ruled Alola in times of antiquity called it the “cocoon of the stars” and built an altar to worship it.,The king who ruled Alola in times of antiquity called it the “cocoon of the stars” and built an altar to worship it.,The king who ruled Alola in times of antiquity called it the “cocoon of the stars” and built an altar to worship it.,The king who ruled Alola in times of antiquity called it the “cocoon of the stars” and built an altar to worship it.
Sometimes the result of its opening an Ultra Wormhole is that energy and life-forms from other worlds are called here to this world.,Sometimes the result of its opening an Ultra Wormhole is that energy and life-forms from other worlds are called here to this world.,Sometimes the result of its opening an Ultra Wormhole is that energy and life-forms from other worlds are called here to this world.,Sometimes the result of its opening an Ultra Wormhole is that energy and life-forms from other worlds are called here to this world.,Sometimes the result of its opening an Ultra Wormhole is that energy and life-forms from other worlds are called here to this world.,Sometimes the result of its opening an Ultra Wormhole is that energy and life-forms from other worlds are called here to this world.,Sometimes the result of its opening an Ultra Wormhole is that energy and life-forms from other worlds are called here to this world.
"Records of it exist in writings from long, long ago, where it was known by the name “the beast that calls the moon.”","Records of it exist in writings from long, long ago, where it was known by the name “the beast that calls the moon.”","Records of it exist in writings from long, long ago, where it was known by the name “the beast that calls the moon.”","Records of it exist in writings from long, long ago, where it was known by the name “the beast that calls the moon.”","Records of it exist in writings from long, long ago, where it was known by the name “the beast that calls the moon.”","Records of it exist in writings from long, long ago, where it was known by the name “the beast that calls the moon.”","Records of it exist in writings from long, long ago, where it was known by the name “the beast that calls the moon.”"
"A life-form from another world, it was dubbed a UB and is thought to produce a strong neurotoxin.","A life-form from another world, it was dubbed a UB and is thought to produce a strong neurotoxin.","A life-form from another world, it was dubbed a UB and is thought to produce a strong neurotoxin.","A life-form from another world, it was dubbed a UB and is thought to produce a strong neurotoxin.","A life-form from another world, it was dubbed a UB and is thought to produce a strong neurotoxin.","A life-form from another world, it was dubbed a UB and is thought to produce a strong neurotoxin.","A life-form from another world, it was dubbed a UB and is thought to produce a strong neurotoxin."
"Although it’s alien to this world and a danger here, it’s apparently a common organism in the world where it normally lives.","Although it’s alien to this world and a danger here, it’s apparently a common organism in the world where it normally lives.","Although it’s alien to this world and a danger here, it’s apparently a common organism in the world where it normally lives.","Although it’s alien to this world and a danger here, it’s apparently a common organism in the world where it normally lives.","Although it’s alien to this world and a danger here, it’s apparently a common organism in the world where it normally lives.","Although it’s alien to this world and a danger here, it’s apparently a common organism in the world where it normally lives.","Although it’s alien to this world and a danger here, it’s apparently a common organism in the world where it normally lives."
"A life-form that lives in another world, its body is thin and supple, but it also possesses great power.","A life-form that lives in another world, its body is thin and supple, but it also possesses great power.","A life-form that lives in another world, its body is thin and supple, but it also possesses great power.","A life-form that lives in another world, its body is thin and supple, but it also possesses great power.","A life-form that lives in another world, its body is thin and supple, but it also possesses great power.","A life-form that lives in another world, its body is thin and supple, but it also possesses great power.","A life-form that lives in another world, its body is thin and supple, but it also possesses great power."
"Although it’s alien to this world and a danger here, it’s apparently a common organism in the world where it normally lives.","Although it’s alien to this world and a danger here, it’s apparently a common organism in the world where it normally lives.","Although it’s alien to this world and a danger here, it’s apparently a common organism in the world where it normally lives.","Although it’s alien to this world and a danger here, it’s apparently a common organism in the world where it normally lives.","Although it’s alien to this world and a danger here, it’s apparently a common organism in the world where it normally lives.","Although it’s alien to this world and a danger here, it’s apparently a common organism in the world where it normally lives.","Although it’s alien to this world and a danger here, it’s apparently a common organism in the world where it normally lives."
"One of the dangerous UBs, high energy readings can be detected coming from both of its huge arms.","One of the dangerous UBs, high energy readings can be detected coming from both of its huge arms.","One of the dangerous UBs, high energy readings can be detected coming from both of its huge arms.","One of the dangerous UBs, high energy readings can be detected coming from both of its huge arms.","One of the dangerous UBs, high energy readings can be detected coming from both of its huge arms.","One of the dangerous UBs, high energy readings can be detected coming from both of its huge arms.","One of the dangerous UBs, high energy readings can be detected coming from both of its huge arms."
"This Ultra Beast’s body, which is as thin as paper, is like a sharpened sword.","This Ultra Beast’s body, which is as thin as paper, is like a sharpened sword.","This Ultra Beast’s body, which is as thin as paper, is like a sharpened sword.","This Ultra Beast’s body, which is as thin as paper, is like a sharpened sword.","This Ultra Beast’s body, which is as thin as paper, is like a sharpened sword.","This Ultra Beast’s body, which is as thin as paper, is like a sharpened sword.","This Ultra Beast’s body, which is as thin as paper, is like a sharpened sword."
"Although it’s alien to this world and a danger here, it’s apparently a common organism in the world where it normally lives.","Although it’s alien to this world and a danger here, it’s apparently a common organism in the world where it normally lives.","Although it’s alien to this world and a danger here, it’s apparently a common organism in the world where it normally lives.","Although it’s alien to this world and a danger here, it’s apparently a common organism in the world where it normally lives.","Although it’s alien to this world and a danger here, it’s apparently a common organism in the world where it normally lives.","Although it’s alien to this world and a danger here, it’s apparently a common organism in the world where it normally lives.","Although it’s alien to this world and a danger here, it’s apparently a common organism in the world where it normally lives."
"It looks somehow pained as it rages around in search of light, which serves as its energy. It’s apparently from another world.","It looks somehow pained as it rages around in search of light, which serves as its energy. It’s apparently from another world.","It looks somehow pained as it rages around in search of light, which serves as its energy. It’s apparently from another world.","It looks somehow pained as it rages around in search of light, which serves as its energy. It’s apparently from another world.","It looks somehow pained as it rages around in search of light, which serves as its energy. It’s apparently from another world.","It looks somehow pained as it rages around in search of light, which serves as its energy. It’s apparently from another world.","It looks somehow pained as it rages around in search of light, which serves as its energy. It’s apparently from another world."
It synchronizes its consciousness with others to understand their feelings. This faculty makes it useful for taking care of people.,It synchronizes its consciousness with others to understand their feelings. This faculty makes it useful for taking care of people.,It synchronizes its consciousness with others to understand their feelings. This faculty makes it useful for taking care of people.,It synchronizes its consciousness with others to understand their feelings. This faculty makes it useful for taking care of people.,It synchronizes its consciousness with others to understand their feelings. This faculty makes it useful for taking care of people.,It synchronizes its consciousness with others to understand their feelings. This faculty makes it useful for taking care of people.,It synchronizes its consciousness with others to understand their feelings. This faculty makes it useful for taking care of people.
"It slips into the shadows of others and mimics their powers and movements. As it improves, it becomes stronger than those it’s imitating.","It slips into the shadows of others and mimics their powers and movements. As it improves, it becomes stronger than those it’s imitating.","It slips into the shadows of others and mimics their powers and movements. As it improves, it becomes stronger than those it’s imitating.","It slips into the shadows of others and mimics their powers and movements. As it improves, it becomes stronger than those it’s imitating.","It slips into the shadows of others and mimics their powers and movements. As it improves, it becomes stronger than those it’s imitating.","It slips into the shadows of others and mimics their powers and movements. As it improves, it becomes stronger than those it’s imitating.","It slips into the shadows of others and mimics their powers and movements. As it improves, it becomes stronger than those it’s imitating."
This Ultra Beast is well enough liked to be chosen as a first partner in its own world.,This Ultra Beast is well enough liked to be chosen as a first partner in its own world.,This Ultra Beast is well enough liked to be chosen as a first partner in its own world.,This Ultra Beast is well enough liked to be chosen as a first partner in its own world.,This Ultra Beast is well enough liked to be chosen as a first partner in its own world.,This Ultra Beast is well enough liked to be chosen as a first partner in its own world.,This Ultra Beast is well enough liked to be chosen as a first partner in its own world.
It stores hundreds of liters of poisonous liquid inside its body. It is one of the organisms known as UBs.,It stores hundreds of liters of poisonous liquid inside its body. It is one of the organisms known as UBs.,It stores hundreds of liters of poisonous liquid inside its body. It is one of the organisms known as UBs.,It stores hundreds of liters of poisonous liquid inside its body. It is one of the organisms known as UBs.,It stores hundreds of liters of poisonous liquid inside its body. It is one of the organisms known as UBs.,It stores hundreds of liters of poisonous liquid inside its body. It is one of the organisms known as UBs.,It stores hundreds of liters of poisonous liquid inside its body. It is one of the organisms known as UBs.
It appeared from an Ultra Wormhole. Each one appears to be made up of many life-forms stacked one on top of each other.,It appeared from an Ultra Wormhole. Each one appears to be made up of many life-forms stacked one on top of each other.,It appeared from an Ultra Wormhole. Each one appears to be made up of many life-forms stacked one on top of each other.,It appeared from an Ultra Wormhole. Each one appears to be made up of many life-forms stacked one on top of each other.,It appeared from an Ultra Wormhole. Each one appears to be made up of many life-forms stacked one on top of each other.,It appeared from an Ultra Wormhole. Each one appears to be made up of many life-forms stacked one on top of each other.,It appeared from an Ultra Wormhole. Each one appears to be made up of many life-forms stacked one on top of each other.
"It slithers toward people. Then, without warning, it triggers the explosion of its own head. It’s apparently one kind of Ultra Beast.","It slithers toward people. Then, without warning, it triggers the explosion of its own head. It’s apparently one kind of Ultra Beast.","It slithers toward people. Then, without warning, it triggers the explosion of its own head. It’s apparently one kind of Ultra Beast.","It slithers toward people. Then, without warning, it triggers the explosion of its own head. It’s apparently one kind of Ultra Beast.","It slithers toward people. Then, without warning, it triggers the explosion of its own head. It’s apparently one kind of Ultra Beast.","It slithers toward people. Then, without warning, it triggers the explosion of its own head. It’s apparently one kind of Ultra Beast.","It slithers toward people. Then, without warning, it triggers the explosion of its own head. It’s apparently one kind of Ultra Beast."
"It electrifies its claws and tears its opponents apart with them. Even if they dodge its attack, they’ll be electrocuted by the flying sparks.","It electrifies its claws and tears its opponents apart with them. Even if they dodge its attack, they’ll be electrocuted by the flying sparks.","It electrifies its claws and tears its opponents apart with them. Even if they dodge its attack, they’ll be electrocuted by the flying sparks.","It electrifies its claws and tears its opponents apart with them. Even if they dodge its attack, they’ll be electrocuted by the flying sparks.","It electrifies its claws and tears its opponents apart with them. Even if they dodge its attack, they’ll be electrocuted by the flying sparks.","It electrifies its claws and tears its opponents apart with them. Even if they dodge its attack, they’ll be electrocuted by the flying sparks.","It electrifies its claws and tears its opponents apart with them. Even if they dodge its attack, they’ll be electrocuted by the flying sparks."
