en,fr,it,de,es,ko,kana
"It sleeps in a deep-sea trench. If it flaps its wings, it is said to cause a 40-day storm.","It sleeps in a deep-sea trench. If it flaps its wings, it is said to cause a 40-day storm.","It sleeps in a deep-sea trench. If it flaps its wings, it is said to cause a 40-day storm.","It sleeps in a deep-sea trench. If it flaps its wings, it is said to cause a 40-day storm.","It sleeps in a deep-sea trench. If it flaps its wings, it is said to cause a 40-day storm.","It sleeps in a deep-sea trench. If it flaps its wings, it is said to cause a 40-day storm.","It sleeps in a deep-sea trench. If it flaps its wings, it is said to cause a 40-day storm."
Its feathers are in seven colors. It is said that anyone seeing it is promised eternal happiness.,Its feathers are in seven colors. It is said that anyone seeing it is promised eternal happiness.,Its feathers are in seven colors. It is said that anyone seeing it is promised eternal happiness.,Its feathers are in seven colors. It is said that anyone seeing it is promised eternal happiness.,Its feathers are in seven colors. It is said that anyone seeing it is promised eternal happiness.,Its feathers are in seven colors. It is said that anyone seeing it is promised eternal happiness.,Its feathers are in seven colors. It is said that anyone seeing it is promised eternal happiness.
"This Pokémon traveled through time to come from the future. It bolsters grass and trees with its own strength, and it can heal wounds, too.","This Pokémon traveled through time to come from the future. It bolsters grass and trees with its own strength, and it can heal wounds, too.","This Pokémon traveled through time to come from the future. It bolsters grass and trees with its own strength, and it can heal wounds, too.","This Pokémon traveled through time to come from the future. It bolsters grass and trees with its own strength, and it can heal wounds, too.","This Pokémon traveled through time to come from the future. It bolsters grass and trees with its own strength, and it can heal wounds, too.","This Pokémon traveled through time to come from the future. It bolsters grass and trees with its own strength, and it can heal wounds, too.","This Pokémon traveled through time to come from the future. It bolsters grass and trees with its own strength, and it can heal wounds, too."
"The soles of its feet are covered by countless tiny hooks, enabling it to walk on walls and ceilings.","The soles of its feet are covered by countless tiny hooks, enabling it to walk on walls and ceilings.","The soles of its feet are covered by countless tiny hooks, enabling it to walk on walls and ceilings.","The soles of its feet are covered by countless tiny hooks, enabling it to walk on walls and ceilings.","The soles of its feet are covered by countless tiny hooks, enabling it to walk on walls and ceilings.","The soles of its feet are covered by countless tiny hooks, enabling it to walk on walls and ceilings.","The soles of its feet are covered by countless tiny hooks, enabling it to walk on walls and ceilings."
"It lives in dense jungles. While closing in on its prey, it leaps from branch to branch.","It lives in dense jungles. While closing in on its prey, it leaps from branch to branch.","It lives in dense jungles. While closing in on its prey, it leaps from branch to branch.","It lives in dense jungles. While closing in on its prey, it leaps from branch to branch.","It lives in dense jungles. While closing in on its prey, it leaps from branch to branch.","It lives in dense jungles. While closing in on its prey, it leaps from branch to branch.","It lives in dense jungles. While closing in on its prey, it leaps from branch to branch."
The leaves that grow on its arms can slice down thick trees. It is without peer in jungle combat.,The leaves that grow on its arms can slice down thick trees. It is without peer in jungle combat.,The leaves that grow on its arms can slice down thick trees. It is without peer in jungle combat.,The leaves that grow on its arms can slice down thick trees. It is without peer in jungle combat.,The leaves that grow on its arms can slice down thick trees. It is without peer in jungle combat.,The leaves that grow on its arms can slice down thick trees. It is without peer in jungle combat.,The leaves that grow on its arms can slice down thick trees. It is without peer in jungle combat.
"A fire burns inside it, so it feels very warm to hug. It launches fireballs of 1,800 degrees Fahrenheit.","A fire burns inside it, so it feels very warm to hug. It launches fireballs of 1,800 degrees Fahrenheit.","A fire burns inside it, so it feels very warm to hug. It launches fireballs of 1,800 degrees Fahrenheit.","A fire burns inside it, so it feels very warm to hug. It launches fireballs of 1,800 degrees Fahrenheit.","A fire burns inside it, so it feels very warm to hug. It launches fireballs of 1,800 degrees Fahrenheit.","A fire burns inside it, so it feels very warm to hug. It launches fireballs of 1,800 degrees Fahrenheit.","A fire burns inside it, so it feels very warm to hug. It launches fireballs of 1,800 degrees Fahrenheit."
Its kicking mastery lets it loose 10 kicks per second. It emits sharp cries to intimidate foes.,Its kicking mastery lets it loose 10 kicks per second. It emits sharp cries to intimidate foes.,Its kicking mastery lets it loose 10 kicks per second. It emits sharp cries to intimidate foes.,Its kicking mastery lets it loose 10 kicks per second. It emits sharp cries to intimidate foes.,Its kicking mastery lets it loose 10 kicks per second. It emits sharp cries to intimidate foes.,Its kicking mastery lets it loose 10 kicks per second. It emits sharp cries to intimidate foes.,Its kicking mastery lets it loose 10 kicks per second. It emits sharp cries to intimidate foes.
"Flames spout from its wrists, enveloping its knuckles. Its punches scorch its foes.","Flames spout from its wrists, enveloping its knuckles. Its punches scorch its foes.","Flames spout from its wrists, enveloping its knuckles. Its punches scorch its foes.","Flames spout from its wrists, enveloping its knuckles. Its punches scorch its foes.","Flames spout from its wrists, enveloping its knuckles. Its punches scorch its foes.","Flames spout from its wrists, enveloping its knuckles. Its punches scorch its foes.","Flames spout from its wrists, enveloping its knuckles. Its punches scorch its foes."
"Using the fin on its head, Mudkip senses the flow of water to keep track of what’s going on around it. Mudkip has the strength to heft boulders.","Using the fin on its head, Mudkip senses the flow of water to keep track of what’s going on around it. Mudkip has the strength to heft boulders.","Using the fin on its head, Mudkip senses the flow of water to keep track of what’s going on around it. Mudkip has the strength to heft boulders.","Using the fin on its head, Mudkip senses the flow of water to keep track of what’s going on around it. Mudkip has the strength to heft boulders.","Using the fin on its head, Mudkip senses the flow of water to keep track of what’s going on around it. Mudkip has the strength to heft boulders.","Using the fin on its head, Mudkip senses the flow of water to keep track of what’s going on around it. Mudkip has the strength to heft boulders.","Using the fin on its head, Mudkip senses the flow of water to keep track of what’s going on around it. Mudkip has the strength to heft boulders."
"Its sturdy legs give it sure footing, even in mud. It burrows into dirt to sleep.","Its sturdy legs give it sure footing, even in mud. It burrows into dirt to sleep.","Its sturdy legs give it sure footing, even in mud. It burrows into dirt to sleep.","Its sturdy legs give it sure footing, even in mud. It burrows into dirt to sleep.","Its sturdy legs give it sure footing, even in mud. It burrows into dirt to sleep.","Its sturdy legs give it sure footing, even in mud. It burrows into dirt to sleep.","Its sturdy legs give it sure footing, even in mud. It burrows into dirt to sleep."
It can swim while towing a large ship. It bashes down foes with a swing of its thick arms.,It can swim while towing a large ship. It bashes down foes with a swing of its thick arms.,It can swim while towing a large ship. It bashes down foes with a swing of its thick arms.,It can swim while towing a large ship. It bashes down foes with a swing of its thick arms.,It can swim while towing a large ship. It bashes down foes with a swing of its thick arms.,It can swim while towing a large ship. It bashes down foes with a swing of its thick arms.,It can swim while towing a large ship. It bashes down foes with a swing of its thick arms.
"A Pokémon with a persistent nature, it chases its chosen prey until the prey becomes exhausted.","A Pokémon with a persistent nature, it chases its chosen prey until the prey becomes exhausted.","A Pokémon with a persistent nature, it chases its chosen prey until the prey becomes exhausted.","A Pokémon with a persistent nature, it chases its chosen prey until the prey becomes exhausted.","A Pokémon with a persistent nature, it chases its chosen prey until the prey becomes exhausted.","A Pokémon with a persistent nature, it chases its chosen prey until the prey becomes exhausted.","A Pokémon with a persistent nature, it chases its chosen prey until the prey becomes exhausted."
It chases down prey in a pack. It will never disobey the commands of a skilled Trainer.,It chases down prey in a pack. It will never disobey the commands of a skilled Trainer.,It chases down prey in a pack. It will never disobey the commands of a skilled Trainer.,It chases down prey in a pack. It will never disobey the commands of a skilled Trainer.,It chases down prey in a pack. It will never disobey the commands of a skilled Trainer.,It chases down prey in a pack. It will never disobey the commands of a skilled Trainer.,It chases down prey in a pack. It will never disobey the commands of a skilled Trainer.
"Zigzagoon that adapted to regions outside Galar acquired this appearance. If you’ve lost something, this Pokémon can likely find it.","Zigzagoon that adapted to regions outside Galar acquired this appearance. If you’ve lost something, this Pokémon can likely find it.","Zigzagoon that adapted to regions outside Galar acquired this appearance. If you’ve lost something, this Pokémon can likely find it.","Zigzagoon that adapted to regions outside Galar acquired this appearance. If you’ve lost something, this Pokémon can likely find it.","Zigzagoon that adapted to regions outside Galar acquired this appearance. If you’ve lost something, this Pokémon can likely find it.","Zigzagoon that adapted to regions outside Galar acquired this appearance. If you’ve lost something, this Pokémon can likely find it.","Zigzagoon that adapted to regions outside Galar acquired this appearance. If you’ve lost something, this Pokémon can likely find it."
It uses its explosive speed and razor-sharp claws to bring down prey. Running along winding paths is not its strong suit.,It uses its explosive speed and razor-sharp claws to bring down prey. Running along winding paths is not its strong suit.,It uses its explosive speed and razor-sharp claws to bring down prey. Running along winding paths is not its strong suit.,It uses its explosive speed and razor-sharp claws to bring down prey. Running along winding paths is not its strong suit.,It uses its explosive speed and razor-sharp claws to bring down prey. Running along winding paths is not its strong suit.,It uses its explosive speed and razor-sharp claws to bring down prey. Running along winding paths is not its strong suit.,It uses its explosive speed and razor-sharp claws to bring down prey. Running along winding paths is not its strong suit.
It spits a white silk thread that turns sticky when coming into contact with air. The silk is used to immobilize foes.,It spits a white silk thread that turns sticky when coming into contact with air. The silk is used to immobilize foes.,It spits a white silk thread that turns sticky when coming into contact with air. The silk is used to immobilize foes.,It spits a white silk thread that turns sticky when coming into contact with air. The silk is used to immobilize foes.,It spits a white silk thread that turns sticky when coming into contact with air. The silk is used to immobilize foes.,It spits a white silk thread that turns sticky when coming into contact with air. The silk is used to immobilize foes.,It spits a white silk thread that turns sticky when coming into contact with air. The silk is used to immobilize foes.
It drinks dew that collects on its silk while it waits for evolution. Its hard cocoon repels attacks.,It drinks dew that collects on its silk while it waits for evolution. Its hard cocoon repels attacks.,It drinks dew that collects on its silk while it waits for evolution. Its hard cocoon repels attacks.,It drinks dew that collects on its silk while it waits for evolution. Its hard cocoon repels attacks.,It drinks dew that collects on its silk while it waits for evolution. Its hard cocoon repels attacks.,It drinks dew that collects on its silk while it waits for evolution. Its hard cocoon repels attacks.,It drinks dew that collects on its silk while it waits for evolution. Its hard cocoon repels attacks.
"When flower fields bloom, it flits around, collecting pollen. Despite its appearance, it is savage.","When flower fields bloom, it flits around, collecting pollen. Despite its appearance, it is savage.","When flower fields bloom, it flits around, collecting pollen. Despite its appearance, it is savage.","When flower fields bloom, it flits around, collecting pollen. Despite its appearance, it is savage.","When flower fields bloom, it flits around, collecting pollen. Despite its appearance, it is savage.","When flower fields bloom, it flits around, collecting pollen. Despite its appearance, it is savage.","When flower fields bloom, it flits around, collecting pollen. Despite its appearance, it is savage."
"Encased within its tough cocoon, it endures attacks. It never forgets the appearance of its foes.","Encased within its tough cocoon, it endures attacks. It never forgets the appearance of its foes.","Encased within its tough cocoon, it endures attacks. It never forgets the appearance of its foes.","Encased within its tough cocoon, it endures attacks. It never forgets the appearance of its foes.","Encased within its tough cocoon, it endures attacks. It never forgets the appearance of its foes.","Encased within its tough cocoon, it endures attacks. It never forgets the appearance of its foes.","Encased within its tough cocoon, it endures attacks. It never forgets the appearance of its foes."
It violently flutters its wings to scatter toxic dust when attacked. It becomes active after sunset.,It violently flutters its wings to scatter toxic dust when attacked. It becomes active after sunset.,It violently flutters its wings to scatter toxic dust when attacked. It becomes active after sunset.,It violently flutters its wings to scatter toxic dust when attacked. It becomes active after sunset.,It violently flutters its wings to scatter toxic dust when attacked. It becomes active after sunset.,It violently flutters its wings to scatter toxic dust when attacked. It becomes active after sunset.,It violently flutters its wings to scatter toxic dust when attacked. It becomes active after sunset.
Its leaf grew too large for it to live on land. That is how it began to live floating in the water.,Its leaf grew too large for it to live on land. That is how it began to live floating in the water.,Its leaf grew too large for it to live on land. That is how it began to live floating in the water.,Its leaf grew too large for it to live on land. That is how it began to live floating in the water.,Its leaf grew too large for it to live on land. That is how it began to live floating in the water.,Its leaf grew too large for it to live on land. That is how it began to live floating in the water.,Its leaf grew too large for it to live on land. That is how it began to live floating in the water.
It lives at the water’s edge where it is sunny. It sleeps on a bed of water grass by day and becomes active at night.,It lives at the water’s edge where it is sunny. It sleeps on a bed of water grass by day and becomes active at night.,It lives at the water’s edge where it is sunny. It sleeps on a bed of water grass by day and becomes active at night.,It lives at the water’s edge where it is sunny. It sleeps on a bed of water grass by day and becomes active at night.,It lives at the water’s edge where it is sunny. It sleeps on a bed of water grass by day and becomes active at night.,It lives at the water’s edge where it is sunny. It sleeps on a bed of water grass by day and becomes active at night.,It lives at the water’s edge where it is sunny. It sleeps on a bed of water grass by day and becomes active at night.
"If it hears festive music, it begins moving in rhythm in order to amplify its power.","If it hears festive music, it begins moving in rhythm in order to amplify its power.","If it hears festive music, it begins moving in rhythm in order to amplify its power.","If it hears festive music, it begins moving in rhythm in order to amplify its power.","If it hears festive music, it begins moving in rhythm in order to amplify its power.","If it hears festive music, it begins moving in rhythm in order to amplify its power.","If it hears festive music, it begins moving in rhythm in order to amplify its power."
It attaches itself to a tree branch using the top of its head. Strong winds can sometimes make it fall.,It attaches itself to a tree branch using the top of its head. Strong winds can sometimes make it fall.,It attaches itself to a tree branch using the top of its head. Strong winds can sometimes make it fall.,It attaches itself to a tree branch using the top of its head. Strong winds can sometimes make it fall.,It attaches itself to a tree branch using the top of its head. Strong winds can sometimes make it fall.,It attaches itself to a tree branch using the top of its head. Strong winds can sometimes make it fall.,It attaches itself to a tree branch using the top of its head. Strong winds can sometimes make it fall.
They live in holes bored in large trees. The sound of Nuzleaf’s grass flute fills listeners with dread.,They live in holes bored in large trees. The sound of Nuzleaf’s grass flute fills listeners with dread.,They live in holes bored in large trees. The sound of Nuzleaf’s grass flute fills listeners with dread.,They live in holes bored in large trees. The sound of Nuzleaf’s grass flute fills listeners with dread.,They live in holes bored in large trees. The sound of Nuzleaf’s grass flute fills listeners with dread.,They live in holes bored in large trees. The sound of Nuzleaf’s grass flute fills listeners with dread.,They live in holes bored in large trees. The sound of Nuzleaf’s grass flute fills listeners with dread.
It lives quietly in the deep forest. It is said to create chilly winter winds with the fans it holds.,It lives quietly in the deep forest. It is said to create chilly winter winds with the fans it holds.,It lives quietly in the deep forest. It is said to create chilly winter winds with the fans it holds.,It lives quietly in the deep forest. It is said to create chilly winter winds with the fans it holds.,It lives quietly in the deep forest. It is said to create chilly winter winds with the fans it holds.,It lives quietly in the deep forest. It is said to create chilly winter winds with the fans it holds.,It lives quietly in the deep forest. It is said to create chilly winter winds with the fans it holds.
It has a gutsy spirit that makes it bravely take on tough foes. It flies in search of warm climates.,It has a gutsy spirit that makes it bravely take on tough foes. It flies in search of warm climates.,It has a gutsy spirit that makes it bravely take on tough foes. It flies in search of warm climates.,It has a gutsy spirit that makes it bravely take on tough foes. It flies in search of warm climates.,It has a gutsy spirit that makes it bravely take on tough foes. It flies in search of warm climates.,It has a gutsy spirit that makes it bravely take on tough foes. It flies in search of warm climates.,It has a gutsy spirit that makes it bravely take on tough foes. It flies in search of warm climates.
It circles the sky in search of prey and dives sharply to catch its target.,It circles the sky in search of prey and dives sharply to catch its target.,It circles the sky in search of prey and dives sharply to catch its target.,It circles the sky in search of prey and dives sharply to catch its target.,It circles the sky in search of prey and dives sharply to catch its target.,It circles the sky in search of prey and dives sharply to catch its target.,It circles the sky in search of prey and dives sharply to catch its target.
"With its long, thin wings, it catches updrafts and flies like a glider high up into the sky.","With its long, thin wings, it catches updrafts and flies like a glider high up into the sky.","With its long, thin wings, it catches updrafts and flies like a glider high up into the sky.","With its long, thin wings, it catches updrafts and flies like a glider high up into the sky.","With its long, thin wings, it catches updrafts and flies like a glider high up into the sky.","With its long, thin wings, it catches updrafts and flies like a glider high up into the sky.","With its long, thin wings, it catches updrafts and flies like a glider high up into the sky."
It places small Pokémon into its spacious beak and carries them around. No one knows where it’s taking them.,It places small Pokémon into its spacious beak and carries them around. No one knows where it’s taking them.,It places small Pokémon into its spacious beak and carries them around. No one knows where it’s taking them.,It places small Pokémon into its spacious beak and carries them around. No one knows where it’s taking them.,It places small Pokémon into its spacious beak and carries them around. No one knows where it’s taking them.,It places small Pokémon into its spacious beak and carries them around. No one knows where it’s taking them.,It places small Pokémon into its spacious beak and carries them around. No one knows where it’s taking them.
"If its horns capture the warm feelings of people or Pokémon, its body warms up slightly.","If its horns capture the warm feelings of people or Pokémon, its body warms up slightly.","If its horns capture the warm feelings of people or Pokémon, its body warms up slightly.","If its horns capture the warm feelings of people or Pokémon, its body warms up slightly.","If its horns capture the warm feelings of people or Pokémon, its body warms up slightly.","If its horns capture the warm feelings of people or Pokémon, its body warms up slightly.","If its horns capture the warm feelings of people or Pokémon, its body warms up slightly."
It has a psychic power that enables it to distort the space around it and see into the future.,It has a psychic power that enables it to distort the space around it and see into the future.,It has a psychic power that enables it to distort the space around it and see into the future.,It has a psychic power that enables it to distort the space around it and see into the future.,It has a psychic power that enables it to distort the space around it and see into the future.,It has a psychic power that enables it to distort the space around it and see into the future.,It has a psychic power that enables it to distort the space around it and see into the future.
"To protect its Trainer, it will expend all its psychic power to create a small black hole.","To protect its Trainer, it will expend all its psychic power to create a small black hole.","To protect its Trainer, it will expend all its psychic power to create a small black hole.","To protect its Trainer, it will expend all its psychic power to create a small black hole.","To protect its Trainer, it will expend all its psychic power to create a small black hole.","To protect its Trainer, it will expend all its psychic power to create a small black hole.","To protect its Trainer, it will expend all its psychic power to create a small black hole."
"If it’s in a pinch, it will secrete a sweet liquid from the tip of its head. Syrup made from gathering that liquid is tasty on bread.","If it’s in a pinch, it will secrete a sweet liquid from the tip of its head. Syrup made from gathering that liquid is tasty on bread.","If it’s in a pinch, it will secrete a sweet liquid from the tip of its head. Syrup made from gathering that liquid is tasty on bread.","If it’s in a pinch, it will secrete a sweet liquid from the tip of its head. Syrup made from gathering that liquid is tasty on bread.","If it’s in a pinch, it will secrete a sweet liquid from the tip of its head. Syrup made from gathering that liquid is tasty on bread.","If it’s in a pinch, it will secrete a sweet liquid from the tip of its head. Syrup made from gathering that liquid is tasty on bread.","If it’s in a pinch, it will secrete a sweet liquid from the tip of its head. Syrup made from gathering that liquid is tasty on bread."
