en,fr,it,de,es,ko,kana
,,,,,,
"While it is young, it uses the nutrients that are stored in the seed on its back in order to grow.","While it is young, it uses the nutrients that are stored in the seed on its back in order to grow.","While it is young, it uses the nutrients that are stored in the seed on its back in order to grow.","While it is young, it uses the nutrients that are stored in the seed on its back in order to grow.","While it is young, it uses the nutrients that are stored in the seed on its back in order to grow.","While it is young, it uses the nutrients that are stored in the seed on its back in order to grow.","While it is young, it uses the nutrients that are stored in the seed on its back in order to grow."
Exposure to sunlight adds to its strength. Sunlight also makes the bud on its back grow larger.,Exposure to sunlight adds to its strength. Sunlight also makes the bud on its back grow larger.,Exposure to sunlight adds to its strength. Sunlight also makes the bud on its back grow larger.,Exposure to sunlight adds to its strength. Sunlight also makes the bud on its back grow larger.,Exposure to sunlight adds to its strength. Sunlight also makes the bud on its back grow larger.,Exposure to sunlight adds to its strength. Sunlight also makes the bud on its back grow larger.,Exposure to sunlight adds to its strength. Sunlight also makes the bud on its back grow larger.
A bewitching aroma wafts from its flower. The fragrance becalms those engaged in a battle.,A bewitching aroma wafts from its flower. The fragrance becalms those engaged in a battle.,A bewitching aroma wafts from its flower. The fragrance becalms those engaged in a battle.,A bewitching aroma wafts from its flower. The fragrance becalms those engaged in a battle.,A bewitching aroma wafts from its flower. The fragrance becalms those engaged in a battle.,A bewitching aroma wafts from its flower. The fragrance becalms those engaged in a battle.,A bewitching aroma wafts from its flower. The fragrance becalms those engaged in a battle.
"From the time it is born, a flame burns at the tip of its tail. Its life would end if the flame were to go out.","From the time it is born, a flame burns at the tip of its tail. Its life would end if the flame were to go out.","From the time it is born, a flame burns at the tip of its tail. Its life would end if the flame were to go out.","From the time it is born, a flame burns at the tip of its tail. Its life would end if the flame were to go out.","From the time it is born, a flame burns at the tip of its tail. Its life would end if the flame were to go out.","From the time it is born, a flame burns at the tip of its tail. Its life would end if the flame were to go out.","From the time it is born, a flame burns at the tip of its tail. Its life would end if the flame were to go out."
"If it becomes agitated during battle, it spouts intense flames, incinerating its surroundings.","If it becomes agitated during battle, it spouts intense flames, incinerating its surroundings.","If it becomes agitated during battle, it spouts intense flames, incinerating its surroundings.","If it becomes agitated during battle, it spouts intense flames, incinerating its surroundings.","If it becomes agitated during battle, it spouts intense flames, incinerating its surroundings.","If it becomes agitated during battle, it spouts intense flames, incinerating its surroundings.","If it becomes agitated during battle, it spouts intense flames, incinerating its surroundings."
"Its wings can carry this Pokémon close to an altitude of 4,600 feet. It blows out fire at very high temperatures.","Its wings can carry this Pokémon close to an altitude of 4,600 feet. It blows out fire at very high temperatures.","Its wings can carry this Pokémon close to an altitude of 4,600 feet. It blows out fire at very high temperatures.","Its wings can carry this Pokémon close to an altitude of 4,600 feet. It blows out fire at very high temperatures.","Its wings can carry this Pokémon close to an altitude of 4,600 feet. It blows out fire at very high temperatures.","Its wings can carry this Pokémon close to an altitude of 4,600 feet. It blows out fire at very high temperatures.","Its wings can carry this Pokémon close to an altitude of 4,600 feet. It blows out fire at very high temperatures."
"When it feels threatened, it draws its limbs inside its shell and sprays water from its mouth.","When it feels threatened, it draws its limbs inside its shell and sprays water from its mouth.","When it feels threatened, it draws its limbs inside its shell and sprays water from its mouth.","When it feels threatened, it draws its limbs inside its shell and sprays water from its mouth.","When it feels threatened, it draws its limbs inside its shell and sprays water from its mouth.","When it feels threatened, it draws its limbs inside its shell and sprays water from its mouth.","When it feels threatened, it draws its limbs inside its shell and sprays water from its mouth."
It cleverly controls its furry ears and tail to maintain its balance while swimming.,It cleverly controls its furry ears and tail to maintain its balance while swimming.,It cleverly controls its furry ears and tail to maintain its balance while swimming.,It cleverly controls its furry ears and tail to maintain its balance while swimming.,It cleverly controls its furry ears and tail to maintain its balance while swimming.,It cleverly controls its furry ears and tail to maintain its balance while swimming.,It cleverly controls its furry ears and tail to maintain its balance while swimming.
The rocket cannons on its shell fire jets of water capable of punching holes through thick steel.,The rocket cannons on its shell fire jets of water capable of punching holes through thick steel.,The rocket cannons on its shell fire jets of water capable of punching holes through thick steel.,The rocket cannons on its shell fire jets of water capable of punching holes through thick steel.,The rocket cannons on its shell fire jets of water capable of punching holes through thick steel.,The rocket cannons on its shell fire jets of water capable of punching holes through thick steel.,The rocket cannons on its shell fire jets of water capable of punching holes through thick steel.
"Perhaps because it would like to grow up quickly, it has a voracious appetite, eating a hundred leaves a day.","Perhaps because it would like to grow up quickly, it has a voracious appetite, eating a hundred leaves a day.","Perhaps because it would like to grow up quickly, it has a voracious appetite, eating a hundred leaves a day.","Perhaps because it would like to grow up quickly, it has a voracious appetite, eating a hundred leaves a day.","Perhaps because it would like to grow up quickly, it has a voracious appetite, eating a hundred leaves a day.","Perhaps because it would like to grow up quickly, it has a voracious appetite, eating a hundred leaves a day.","Perhaps because it would like to grow up quickly, it has a voracious appetite, eating a hundred leaves a day."
Its shell is filled with a thick liquid. All of the cells throughout its body are being rebuilt in preparation for evolution.,Its shell is filled with a thick liquid. All of the cells throughout its body are being rebuilt in preparation for evolution.,Its shell is filled with a thick liquid. All of the cells throughout its body are being rebuilt in preparation for evolution.,Its shell is filled with a thick liquid. All of the cells throughout its body are being rebuilt in preparation for evolution.,Its shell is filled with a thick liquid. All of the cells throughout its body are being rebuilt in preparation for evolution.,Its shell is filled with a thick liquid. All of the cells throughout its body are being rebuilt in preparation for evolution.,Its shell is filled with a thick liquid. All of the cells throughout its body are being rebuilt in preparation for evolution.
"Its wings are covered in toxic scales. If it finds bird Pokémon going after Caterpie, Butterfree sprinkles its scales on them to drive them off.","Its wings are covered in toxic scales. If it finds bird Pokémon going after Caterpie, Butterfree sprinkles its scales on them to drive them off.","Its wings are covered in toxic scales. If it finds bird Pokémon going after Caterpie, Butterfree sprinkles its scales on them to drive them off.","Its wings are covered in toxic scales. If it finds bird Pokémon going after Caterpie, Butterfree sprinkles its scales on them to drive them off.","Its wings are covered in toxic scales. If it finds bird Pokémon going after Caterpie, Butterfree sprinkles its scales on them to drive them off.","Its wings are covered in toxic scales. If it finds bird Pokémon going after Caterpie, Butterfree sprinkles its scales on them to drive them off.","Its wings are covered in toxic scales. If it finds bird Pokémon going after Caterpie, Butterfree sprinkles its scales on them to drive them off."
It eats its weight in leaves every day. It fends off attackers with the needle on its head.,It eats its weight in leaves every day. It fends off attackers with the needle on its head.,It eats its weight in leaves every day. It fends off attackers with the needle on its head.,It eats its weight in leaves every day. It fends off attackers with the needle on its head.,It eats its weight in leaves every day. It fends off attackers with the needle on its head.,It eats its weight in leaves every day. It fends off attackers with the needle on its head.,It eats its weight in leaves every day. It fends off attackers with the needle on its head.
"While awaiting evolution, it hides from predators under leaves and in nooks of branches.","While awaiting evolution, it hides from predators under leaves and in nooks of branches.","While awaiting evolution, it hides from predators under leaves and in nooks of branches.","While awaiting evolution, it hides from predators under leaves and in nooks of branches.","While awaiting evolution, it hides from predators under leaves and in nooks of branches.","While awaiting evolution, it hides from predators under leaves and in nooks of branches.","While awaiting evolution, it hides from predators under leaves and in nooks of branches."
"Its best attack involves flying around at high speed, striking with poison needles, then flying off.","Its best attack involves flying around at high speed, striking with poison needles, then flying off.","Its best attack involves flying around at high speed, striking with poison needles, then flying off.","Its best attack involves flying around at high speed, striking with poison needles, then flying off.","Its best attack involves flying around at high speed, striking with poison needles, then flying off.","Its best attack involves flying around at high speed, striking with poison needles, then flying off.","Its best attack involves flying around at high speed, striking with poison needles, then flying off."
"It is docile and prefers to avoid conflict. If disturbed, however, it can ferociously strike back.","It is docile and prefers to avoid conflict. If disturbed, however, it can ferociously strike back.","It is docile and prefers to avoid conflict. If disturbed, however, it can ferociously strike back.","It is docile and prefers to avoid conflict. If disturbed, however, it can ferociously strike back.","It is docile and prefers to avoid conflict. If disturbed, however, it can ferociously strike back.","It is docile and prefers to avoid conflict. If disturbed, however, it can ferociously strike back.","It is docile and prefers to avoid conflict. If disturbed, however, it can ferociously strike back."
"It flies over its wide territory in search of prey, downing it with its highly developed claws.","It flies over its wide territory in search of prey, downing it with its highly developed claws.","It flies over its wide territory in search of prey, downing it with its highly developed claws.","It flies over its wide territory in search of prey, downing it with its highly developed claws.","It flies over its wide territory in search of prey, downing it with its highly developed claws.","It flies over its wide territory in search of prey, downing it with its highly developed claws.","It flies over its wide territory in search of prey, downing it with its highly developed claws."
"By flapping its wings with all its might, Pidgeot can make a gust of wind capable of bending tall trees.","By flapping its wings with all its might, Pidgeot can make a gust of wind capable of bending tall trees.","By flapping its wings with all its might, Pidgeot can make a gust of wind capable of bending tall trees.","By flapping its wings with all its might, Pidgeot can make a gust of wind capable of bending tall trees.","By flapping its wings with all its might, Pidgeot can make a gust of wind capable of bending tall trees.","By flapping its wings with all its might, Pidgeot can make a gust of wind capable of bending tall trees.","By flapping its wings with all its might, Pidgeot can make a gust of wind capable of bending tall trees."
"Its incisors grow continuously throughout its life. If its incisors get too long, this Pokémon becomes unable to eat, and it starves to death.","Its incisors grow continuously throughout its life. If its incisors get too long, this Pokémon becomes unable to eat, and it starves to death.","Its incisors grow continuously throughout its life. If its incisors get too long, this Pokémon becomes unable to eat, and it starves to death.","Its incisors grow continuously throughout its life. If its incisors get too long, this Pokémon becomes unable to eat, and it starves to death.","Its incisors grow continuously throughout its life. If its incisors get too long, this Pokémon becomes unable to eat, and it starves to death.","Its incisors grow continuously throughout its life. If its incisors get too long, this Pokémon becomes unable to eat, and it starves to death.","Its incisors grow continuously throughout its life. If its incisors get too long, this Pokémon becomes unable to eat, and it starves to death."
People say that it fled from its enemies by using its small webbed hind feet to swim from island to island in Alola.,People say that it fled from its enemies by using its small webbed hind feet to swim from island to island in Alola.,People say that it fled from its enemies by using its small webbed hind feet to swim from island to island in Alola.,People say that it fled from its enemies by using its small webbed hind feet to swim from island to island in Alola.,People say that it fled from its enemies by using its small webbed hind feet to swim from island to island in Alola.,People say that it fled from its enemies by using its small webbed hind feet to swim from island to island in Alola.,People say that it fled from its enemies by using its small webbed hind feet to swim from island to island in Alola.
Its reckless nature leads it to stand up to others—even large Pokémon—if it has to protect its territory.,Its reckless nature leads it to stand up to others—even large Pokémon—if it has to protect its territory.,Its reckless nature leads it to stand up to others—even large Pokémon—if it has to protect its territory.,Its reckless nature leads it to stand up to others—even large Pokémon—if it has to protect its territory.,Its reckless nature leads it to stand up to others—even large Pokémon—if it has to protect its territory.,Its reckless nature leads it to stand up to others—even large Pokémon—if it has to protect its territory.,Its reckless nature leads it to stand up to others—even large Pokémon—if it has to protect its territory.
Carrying food through Fearow’s territory is dangerous. It will snatch the food away from you in a flash!,Carrying food through Fearow’s territory is dangerous. It will snatch the food away from you in a flash!,Carrying food through Fearow’s territory is dangerous. It will snatch the food away from you in a flash!,Carrying food through Fearow’s territory is dangerous. It will snatch the food away from you in a flash!,Carrying food through Fearow’s territory is dangerous. It will snatch the food away from you in a flash!,Carrying food through Fearow’s territory is dangerous. It will snatch the food away from you in a flash!,Carrying food through Fearow’s territory is dangerous. It will snatch the food away from you in a flash!
"By dislocating its jaw, it can swallow prey larger than itself. After a meal, it curls up and rests.","By dislocating its jaw, it can swallow prey larger than itself. After a meal, it curls up and rests.","By dislocating its jaw, it can swallow prey larger than itself. After a meal, it curls up and rests.","By dislocating its jaw, it can swallow prey larger than itself. After a meal, it curls up and rests.","By dislocating its jaw, it can swallow prey larger than itself. After a meal, it curls up and rests.","By dislocating its jaw, it can swallow prey larger than itself. After a meal, it curls up and rests.","By dislocating its jaw, it can swallow prey larger than itself. After a meal, it curls up and rests."
The latest research has determined that there are over 20 possible arrangements of the patterns on its stomach.,The latest research has determined that there are over 20 possible arrangements of the patterns on its stomach.,The latest research has determined that there are over 20 possible arrangements of the patterns on its stomach.,The latest research has determined that there are over 20 possible arrangements of the patterns on its stomach.,The latest research has determined that there are over 20 possible arrangements of the patterns on its stomach.,The latest research has determined that there are over 20 possible arrangements of the patterns on its stomach.,The latest research has determined that there are over 20 possible arrangements of the patterns on its stomach.
"Its nature is to store up electricity. Forests where nests of Pikachu live are dangerous, since the trees are so often struck by lightning.","Its nature is to store up electricity. Forests where nests of Pikachu live are dangerous, since the trees are so often struck by lightning.","Its nature is to store up electricity. Forests where nests of Pikachu live are dangerous, since the trees are so often struck by lightning.","Its nature is to store up electricity. Forests where nests of Pikachu live are dangerous, since the trees are so often struck by lightning.","Its nature is to store up electricity. Forests where nests of Pikachu live are dangerous, since the trees are so often struck by lightning.","Its nature is to store up electricity. Forests where nests of Pikachu live are dangerous, since the trees are so often struck by lightning.","Its nature is to store up electricity. Forests where nests of Pikachu live are dangerous, since the trees are so often struck by lightning."
"As electricity builds up inside its body, it becomes more aggressive. One theory is that the electricity buildup is actually causing stress.","As electricity builds up inside its body, it becomes more aggressive. One theory is that the electricity buildup is actually causing stress.","As electricity builds up inside its body, it becomes more aggressive. One theory is that the electricity buildup is actually causing stress.","As electricity builds up inside its body, it becomes more aggressive. One theory is that the electricity buildup is actually causing stress.","As electricity builds up inside its body, it becomes more aggressive. One theory is that the electricity buildup is actually causing stress.","As electricity builds up inside its body, it becomes more aggressive. One theory is that the electricity buildup is actually causing stress.","As electricity builds up inside its body, it becomes more aggressive. One theory is that the electricity buildup is actually causing stress."
"It lives in areas of limited rainfall. When danger approaches, it curls up into a ball to protect its soft stomach.","It lives in areas of limited rainfall. When danger approaches, it curls up into a ball to protect its soft stomach.","It lives in areas of limited rainfall. When danger approaches, it curls up into a ball to protect its soft stomach.","It lives in areas of limited rainfall. When danger approaches, it curls up into a ball to protect its soft stomach.","It lives in areas of limited rainfall. When danger approaches, it curls up into a ball to protect its soft stomach.","It lives in areas of limited rainfall. When danger approaches, it curls up into a ball to protect its soft stomach.","It lives in areas of limited rainfall. When danger approaches, it curls up into a ball to protect its soft stomach."
Its claws and horns often break off. The broken claws and horns can be used to carve plows for tilling farm fields.,Its claws and horns often break off. The broken claws and horns can be used to carve plows for tilling farm fields.,Its claws and horns often break off. The broken claws and horns can be used to carve plows for tilling farm fields.,Its claws and horns often break off. The broken claws and horns can be used to carve plows for tilling farm fields.,Its claws and horns often break off. The broken claws and horns can be used to carve plows for tilling farm fields.,Its claws and horns often break off. The broken claws and horns can be used to carve plows for tilling farm fields.,Its claws and horns often break off. The broken claws and horns can be used to carve plows for tilling farm fields.
It uses its hard incisor teeth to crush and eat berries. The tip of a female Nidoran’s horn is a bit more rounded than the tip of a male’s horn.,It uses its hard incisor teeth to crush and eat berries. The tip of a female Nidoran’s horn is a bit more rounded than the tip of a male’s horn.,It uses its hard incisor teeth to crush and eat berries. The tip of a female Nidoran’s horn is a bit more rounded than the tip of a male’s horn.,It uses its hard incisor teeth to crush and eat berries. The tip of a female Nidoran’s horn is a bit more rounded than the tip of a male’s horn.,It uses its hard incisor teeth to crush and eat berries. The tip of a female Nidoran’s horn is a bit more rounded than the tip of a male’s horn.,It uses its hard incisor teeth to crush and eat berries. The tip of a female Nidoran’s horn is a bit more rounded than the tip of a male’s horn.,It uses its hard incisor teeth to crush and eat berries. The tip of a female Nidoran’s horn is a bit more rounded than the tip of a male’s horn.
"If the group is threatened, these Pokémon will band together to assault enemies with a chorus of ultrasonic waves.","If the group is threatened, these Pokémon will band together to assault enemies with a chorus of ultrasonic waves.","If the group is threatened, these Pokémon will band together to assault enemies with a chorus of ultrasonic waves.","If the group is threatened, these Pokémon will band together to assault enemies with a chorus of ultrasonic waves.","If the group is threatened, these Pokémon will band together to assault enemies with a chorus of ultrasonic waves.","If the group is threatened, these Pokémon will band together to assault enemies with a chorus of ultrasonic waves.","If the group is threatened, these Pokémon will band together to assault enemies with a chorus of ultrasonic waves."
It pacifies offspring by placing them in the gaps between the spines on its back. The spines will never secrete poison while young are present.,It pacifies offspring by placing them in the gaps between the spines on its back. The spines will never secrete poison while young are present.,It pacifies offspring by placing them in the gaps between the spines on its back. The spines will never secrete poison while young are present.,It pacifies offspring by placing them in the gaps between the spines on its back. The spines will never secrete poison while young are present.,It pacifies offspring by placing them in the gaps between the spines on its back. The spines will never secrete poison while young are present.,It pacifies offspring by placing them in the gaps between the spines on its back. The spines will never secrete poison while young are present.,It pacifies offspring by placing them in the gaps between the spines on its back. The spines will never secrete poison while young are present.
"Small but brave, this Pokémon will hold its ground and even risk its life in battle to protect the female it’s friendly with.","Small but brave, this Pokémon will hold its ground and even risk its life in battle to protect the female it’s friendly with.","Small but brave, this Pokémon will hold its ground and even risk its life in battle to protect the female it’s friendly with.","Small but brave, this Pokémon will hold its ground and even risk its life in battle to protect the female it’s friendly with.","Small but brave, this Pokémon will hold its ground and even risk its life in battle to protect the female it’s friendly with.","Small but brave, this Pokémon will hold its ground and even risk its life in battle to protect the female it’s friendly with.","Small but brave, this Pokémon will hold its ground and even risk its life in battle to protect the female it’s friendly with."
